{
  "root": {
    "keyId": "root-2026", "algo": "ed25519",
    "publicKeyHex": "0000000000000000000000000000000000000000000000000000000000000001",
    "offline": true, "immutable": true
  },
  "delegations": {
    "data":      { "keyId": "data-2026", "algo": "ed25519", "publicKeyHex": "0000000000000000000000000000000000000000000000000000000000000002", "threshold": 1, "signedByRoot": true },
    "code":      { "keyId": "code-2026", "algo": "ed25519", "publicKeyHex": "0000000000000000000000000000000000000000000000000000000000000003", "threshold": 2, "signedByRoot": true },
    "snapshot":  { "keyId": "snap-2026", "algo": "ed25519", "publicKeyHex": "0000000000000000000000000000000000000000000000000000000000000004", "signedByRoot": true },
    "timestamp": { "keyId": "ts-2026", "algo": "ed25519", "publicKeyHex": "0000000000000000000000000000000000000000000000000000000000000005", "signedByRoot": true, "maxExpiryDays": 7 }
  },
  "feed": { "baseUrl": "https://updates.example.com/suite", "anchorSource": "baked" },
  "newAppOnboarding": { "requireRootDelegation": true }
}
